{
  "infos": {
    "name": "GENIUS TSM",
    "logo": "genius.png",
    "description": "L‚Äôassociation pour les √©tudiants et entrepreneurs de Toulouse School of Management üöÄ",
    "slogan": "Lib√©rer les g√©nies de demain üí°",
    "year": 2025,
    "email": "ajonathank1@gmail.com"
  },
  "menu": [
    {
      "titre": "Accueil",
      "lien": "index.html"
    },
    {
      "titre": "Calendrier",
      "lien": "calendrier.html"
    },
    {
      "titre": "√âquipe",
      "lien": "equipe.html"
    },
    {
      "titre": "Projets",
      "lien": "projets.html"
    },
    {
      "titre": "Partenaires",
      "lien": "partenaires.html"
    },
    {
      "titre": "Contact",
      "lien": "contact.html"
    }
  ],
  "socials": [
    {
      "nom": "instagram",
      "lien": "https://www.instagram.com/geniustsm"
    },
    {
      "nom": "linkedin",
      "lien": "https://www.linkedin.com/company/geniustsm/"
    },
    {
      "nom": "spotify",
      "lien": "https://open.spotify.com/show/4rdEeLJf8yxIFes0VPsI0T?si=H8_oZiFWQqOlHyL---52LQ&nd=1&dlsi=50c73c2160f24931"
    }
  ],
  "calendrier": [
    {
      "date": "2025-09-04",
      "event": {
        "title": "R√©union √©quipe",
        "description": "10h00 - 11h00 dans la salle A"
      }
    },
    {
      "date": "2025-09-07",
      "event": {
        "title": "Anniversaire de Marie",
        "description": "F√™te √† 19h00"
      }
    },
    {
      "date": "2025-09-15",
      "event": {
        "title": "Projet Deadline",
        "description": "Soumission finale du projet"
      }
    },
    {
      "date": "2025-09-22",
      "event": {
        "title": "Conf√©rence",
        "description": "En ligne √† 14h00"
      }
    }
  ],
  "equipe": [
    {
      "nom": "Bureau",
      "description": "Des passionn√©s pr√™ts √† guider les jeunes entrepreneurs vers le succ√®s.",
      "membres": [
        {
          "nom": "Alice Dupont",
          "role": "Pr√©sidente",
          "photo": "femme.png",
          "description": "Lorem ipsum dolor sit amet, consectetur adipiscing elit. Proin ut nibh leo.",
          "socials": [
            {
              "nom": "instagram",
              "lien": "https://www.instagram.com/geniustsm"
            },
            {
              "nom": "linkedin",
              "lien": "https://www.linkedin.com/company/geniustsm/"
            }
          ]
        },
        {
          "nom": "Marc Leroy",
          "role": "Tr√©sorier",
          "photo": "membre.png",
          "description": "Lorem ipsum dolor sit amet, consectetur adipiscing elit. Proin ut nibh leo.",
          "socials": [
            {
              "nom": "instagram",
              "lien": "https://www.instagram.com/geniustsm"
            },
            {
              "nom": "linkedin",
              "lien": "https://www.linkedin.com/company/geniustsm/"
            }
          ]
        },
        {
          "nom": "Fatima Benali",
          "role": "Secr√©taire",
          "photo": "femme.png",
          "description": "Lorem ipsum dolor sit amet, consectetur adipiscing elit. Proin ut nibh leo.",
          "socials": [
            {
              "nom": "instagram",
              "lien": "https://www.instagram.com/geniustsm"
            },
            {
              "nom": "linkedin",
              "lien": "https://www.linkedin.com/company/geniustsm/"
            }
          ]
        },
        {
          "nom": "Fatima ",
          "role": "Secr√©taire",
          "photo": "femme.png",
          "description": "Lorem ipsum dolor sit amet, consectetur adipiscing elit. Proin ut nibh leo.",
          "socials": [
            {
              "nom": "instagram",
              "lien": "https://www.instagram.com/geniustsm"
            },
            {
              "nom": "linkedin",
              "lien": "https://www.linkedin.com/company/geniustsm/"
            }
          ]
        }
      ]
    },
    {
      "nom": "√âv√®nementiel",
      "description": "Des passionn√©s pr√™ts √† guider les jeunes entrepreneurs vers le succ√®s.",
      "membres": [
        {
          "nom": "Alice Dupont",
          "role": "Pr√©sidente",
          "photo": "femme.png",
          "description": "Lorem ipsum dolor sit amet, consectetur adipiscing elit. Proin ut nibh leo.",
          "socials": [
            {
              "nom": "instagram",
              "lien": "https://www.instagram.com/geniustsm"
            },
            {
              "nom": "linkedin",
              "lien": "https://www.linkedin.com/company/geniustsm/"
            }
          ]
        },
        {
          "nom": "Marc Leroy",
          "role": "Tr√©sorier",
          "photo": "membre.png",
          "description": "Lorem ipsum dolor sit amet, consectetur adipiscing elit. Proin ut nibh leo.",
          "socials": [
            {
              "nom": "instagram",
              "lien": "https://www.instagram.com/geniustsm"
            },
            {
              "nom": "linkedin",
              "lien": "https://www.linkedin.com/company/geniustsm/"
            }
          ]
        },
        {
          "nom": "Fatima Benali",
          "role": "Secr√©taire",
          "photo": "femme.png",
          "description": "Lorem ipsum dolor sit amet, consectetur adipiscing elit. Proin ut nibh leo.",
          "socials": [
            {
              "nom": "instagram",
              "lien": "https://www.instagram.com/geniustsm"
            },
            {
              "nom": "linkedin",
              "lien": "https://www.linkedin.com/company/geniustsm/"
            }
          ]
        }
      ]
    },
    {
      "nom": "Communication",
      "description": "Des passionn√©s pr√™ts √† guider les jeunes entrepreneurs vers le succ√®s.",
      "membres": [
        {
          "nom": "Alice Dupont",
          "role": "Pr√©sidente",
          "photo": "femme.png",
          "description": "Lorem ipsum dolor sit amet, consectetur adipiscing elit. Proin ut nibh leo.",
          "socials": [
            {
              "nom": "instagram",
              "lien": "https://www.instagram.com/geniustsm"
            },
            {
              "nom": "linkedin",
              "lien": "https://www.linkedin.com/company/geniustsm/"
            }
          ]
        },
        {
          "nom": "Marc Leroy",
          "role": "Tr√©sorier",
          "photo": "membre.png",
          "description": "Lorem ipsum dolor sit amet, consectetur adipiscing elit. Proin ut nibh leo.",
          "socials": [
            {
              "nom": "instagram",
              "lien": "https://www.instagram.com/geniustsm"
            },
            {
              "nom": "linkedin",
              "lien": "https://www.linkedin.com/company/geniustsm/"
            }
          ]
        },
        {
          "nom": "Fatima Benali",
          "role": "Secr√©taire",
          "photo": "femme.png",
          "description": "Lorem ipsum dolor sit amet, consectetur adipiscing elit. Proin ut nibh leo.",
          "socials": [
            {
              "nom": "instagram",
              "lien": "https://www.instagram.com/geniustsm"
            },
            {
              "nom": "linkedin",
              "lien": "https://www.linkedin.com/company/geniustsm/"
            }
          ]
        }
      ]
    },
    {
      "nom": "Programme START",
      "description": "Des passionn√©s pr√™ts √† guider les jeunes entrepreneurs vers le succ√®s.",
      "membres": [
        {
          "nom": "Alice Dupont",
          "role": "Pr√©sidente",
          "photo": "femme.png",
          "description": "Lorem ipsum dolor sit amet, consectetur adipiscing elit. Proin ut nibh leo.",
          "socials": [
            {
              "nom": "instagram",
              "lien": "https://www.instagram.com/geniustsm"
            },
            {
              "nom": "linkedin",
              "lien": "https://www.linkedin.com/company/geniustsm/"
            }
          ]
        },
        {
          "nom": "Marc Leroy",
          "role": "Tr√©sorier",
          "photo": "membre.png",
          "description": "Lorem ipsum dolor sit amet, consectetur adipiscing elit. Proin ut nibh leo.",
          "socials": [
            {
              "nom": "instagram",
              "lien": "https://www.instagram.com/geniustsm"
            },
            {
              "nom": "linkedin",
              "lien": "https://www.linkedin.com/company/geniustsm/"
            }
          ]
        },
        {
          "nom": "Fatima Benali",
          "role": "Secr√©taire",
          "photo": "femme.png",
          "description": "Lorem ipsum dolor sit amet, consectetur adipiscing elit. Proin ut nibh leo.",
          "socials": [
            {
              "nom": "instagram",
              "lien": "https://www.instagram.com/geniustsm"
            },
            {
              "nom": "linkedin",
              "lien": "https://www.linkedin.com/company/geniustsm/"
            }
          ]
        }
      ]
    },
    {
      "nom": "Programme BOOST",
      "description": "Des passionn√©s pr√™ts √† guider les jeunes entrepreneurs vers le succ√®s.",
      "membres": [
        {
          "nom": "Alice Dupont",
          "role": "Pr√©sidente",
          "photo": "femme.png",
          "description": "Lorem ipsum dolor sit amet, consectetur adipiscing elit. Proin ut nibh leo.",
          "socials": [
            {
              "nom": "instagram",
              "lien": "https://www.instagram.com/geniustsm"
            },
            {
              "nom": "linkedin",
              "lien": "https://www.linkedin.com/company/geniustsm/"
            }
          ]
        },
        {
          "nom": "Marc Leroy",
          "role": "Tr√©sorier",
          "photo": "membre.png",
          "description": "Lorem ipsum dolor sit amet, consectetur adipiscing elit. Proin ut nibh leo.",
          "socials": [
            {
              "nom": "instagram",